{
  "id": "shielder",
  "name": "Shielder",
  "domain": "Infantry",
  "tags": ["Heavy"],

  "hp": 220,
  "armor": 4,
  "damage": 4,
  "attackSpeed": 0.8,
  "range": 2,
  "splashRadius": 0,
  "projectileSpeed": 14,
  "visionRange": 6,
  "speed": 0.9,

  "maxSquadSize": 12,

  "canTarget": ["Infantry"],

  "cost": { "food": 25 },
  "foodUpkeep": 1,
  "fuelUpkeep": 0,
  "productionTime": 8,

  "notes": "Pure infantry meatshield: only a token attack of its own, but high health and flat damage reduction, meant to soak hits in front of squishier troops rather than deal real damage itself."
}
