{
  "id": "tank_obliterator",
  "name": "Tank Obliterator",
  "domain": "Land",
  "tags": ["Vehicle", "Tank", "Heavy"],

  "hp": 320,
  "armor": 4,
  "damage": 45,
  "attackSpeed": 0.2,
  "range": 5,
  "lineAttack": true,
  "visionRange": 6,
  "speed": 1.9,

  "maxSquadSize": 4,

  "canTarget": ["Infantry", "Land", "Structure", "Defensive"],

  "damageDealtModifiers": { "Structure": 0.6, "Defensive": 0.6},

  "cost": { "food": 40, "steel": 90 },
  "foodUpkeep": 0,
  "fuelUpkeep": 2,
  "productionTime": 48,

  "notes": "Rail gun: lineAttack fires a 1-hex-wide beam from its own hex through the target and out to `range` (5) hexes total, hitting every enemy squad along the line and hard-stopping at the first building in its path (which takes the hit as the beam's terminal target, same as any other victim) — see CombatResolver._apply_line_attack/_beam_hexes and 05-troop-stat-schema.md. Chose a plain slow attackSpeed (0.2, ~5s cycle, matching Earthshaker's) over a multi-tick channel-then-recharge model: the sim's attack loop already resolves one full volley per banked attack_progress unit (see combat_resolver.gd's header comment), so a channel would need brand-new per-squad state (active/recharging, what a freeze mid-channel even means) for no clear gameplay payoff over 'slow cycle, one big beam' — same shape every other heavy hitter in the roster already uses. Anti-blob/anti-formation niche: punishes enemies stacked or lined up behind each other, rather than Earthshaker's single-point splash or Granite Crumbler's pure siege range. Still weak vs. Structure/Defensive (0.6x) so it doesn't outclass the dedicated siege units despite the beam's reach."
}
