{
  "id": "wingfighter",
  "name": "Wingfighter",
  "domain": "Air",
  "tags": ["Aircraft", "Fighter"],

  "hp": 85,
  "damage": 6,
  "attackSpeed": 2.2,
  "range": 3,
  "splashRadius": 0,
  "projectileSpeed": 16,
  "visionRange": 10,
  "speed": 3.2,

  "maxSquadSize": 4,

  "canTarget": ["Infantry", "Land", "Air", "Naval"],

  "damageDealtModifiers": { "Air": 1.4 },

  "cost": { "food": 15, "steel": 35 },
  "foodUpkeep": 0,
  "fuelUpkeep": 3.5,
  "productionTime": 40,

  "notes": "Fast anti-troop dogfighter with rapid-fire guns, the quickest combat aircraft in the roster. Cannot attack buildings, walls, or defenses, so it doesn't double as a siege unit. Especially effective against other aircraft."
}
