{
  "id": "rocket_tank",
  "name": "Rocket Tank",
  "domain": "Land",
  "tags": ["Vehicle", "Tank", "Anti-Air"],

  "hp": 260,
  "armor": 3,
  "damage": 20,
  "attackSpeed": 1.1,
  "range": 6,
  "splashRadius": 0,
  "projectileSpeed": 6,
  "visionRange": 8,
  "speed": 1.9,

  "maxSquadSize": 4,

  "canTarget": ["Land", "Air", "Naval", "Structure", "Defensive"],

  "damageDealtModifiers": { "Air": 2.0, "Naval": 1.6, "Structure": 0.7 },

  "statusEffectOnHit": { "type": "stun", "duration": 1.5, "chance": 20 },

  "cost": { "food": 25, "steel": 70 },
  "foodUpkeep": 0,
  "fuelUpkeep": 2,
  "productionTime": 30,

  "notes": "Dedicated anti-air heavy vehicle with a strong bonus against aircraft and ships and a chance to stun on hit, but weaker against structures and unable to target infantry at all — giving infantry a hard counter against it."
}
