{
  "id": "gunboat",
  "name": "Gunboat",
  "domain": "Naval",
  "tags": ["Ship", "Light"],

  "hp": 130,
  "damage": 12,
  "attackSpeed": 1.3,
  "range": 5,
  "splashRadius": 0,
  "projectileSpeed": 11,
  "visionRange": 10,
  "speed": 2.2,

  "maxSquadSize": 3,

  "canTarget": ["Infantry", "Land", "Naval", "Air", "Structure", "Defensive"],

  "damageDealtModifiers": { "Infantry": 1.4, "Air": 2.2},

  "cost": { "food": 20, "steel": 20 },
  "foodUpkeep": 0,
  "fuelUpkeep": 0.5,
  "productionTime": 16,

  "notes": "Cheap, fast, generalist warship and the navy's reliable early pick. Especially effective against infantry and aircraft, though unremarkable against other ships."
}
