{
  "id": "flamethrower",
  "name": "Flamethrower",
  "domain": "Infantry",
  "tags": ["Fire"],

  "hp": 80,
  "damage": 8,
  "attackSpeed": 1,
  "range": 2,
  "splashRadius": 1,
  "visionRange": 8,
  "speed": 1.1,

  "maxSquadSize": 8,

  "canTarget": ["Infantry", "Land", "Air", "Naval", "Structure", "Defensive"],

  "damageTypes": ["Fire"],

  "cost": { "food": 20 },
  "foodUpkeep": 1,
  "fuelUpkeep": 0,
  "productionTime": 10,

  "notes": "Bonus vs. Wood-tagged targets (walls, docks, bridges, Wood Tower) comes entirely from damageTypes:[Fire] matching those targets' own damageReceivedModifiers (e.g. Wood Wall's {Fire: 2.0}) — no separate damageDealtModifiers needed here, to avoid double-stacking the bonus."
}
