{
  "id": "plasmacopter",
  "name": "Plasmacopter",
  "domain": "Air",
  "tags": ["Aircraft"],

  "hp": 150,
  "damage": 26,
  "attackSpeed": 0.8,
  "range": 6,
  "splashRadius": 1,
  "visionRange": 10,
  "speed": 1.8,

  "maxSquadSize": 2,

  "canTarget": ["Infantry", "Land", "Air", "Naval", "Structure", "Defensive"],

  "damageDealtModifiers": { "Structure": 0.6, "Defensive": 0.8 },

  "cost": { "food": 20, "steel": 55 },
  "foodUpkeep": 0,
  "fuelUpkeep": 3.5,
  "productionTime": 38,

  "notes": "Firebase's bigger, slower Blazeworks unit — longer range and plasma impact rather than Flamecopter's close-in fire spray. Versatile enough to hit Air, unlike Flamecopter. No damage modifiers vs. anything, but weaker against buildings; the hard-hitting generalist counterpart to Flamecopter's Wood-bonus specialization."
}
