{
  "id": "submarine",
  "name": "Submarine",
  "domain": "Naval",
  "tags": ["Ship", "Stealth"],

  "hp": 140,
  "damage": 38,
  "attackSpeed": 0.6,
  "range": 4,
  "splashRadius": 0,
  "projectileSpeed": 5,
  "visionRange": 6,
  "speed": 1.8,

  "maxSquadSize": 3,

  "canTarget": ["Naval"],

  "stealth": true,
  "revealRange": 1,
  "revealsOnAttack": true,

  "cost": { "food": 25, "steel": 60 },
  "foodUpkeep": 0,
  "fuelUpkeep": 1,
  "productionTime": 28,

  "notes": "Naval stealth hunter that can only engage other ships, leaving the rest of a fleet's job to surface vessels. Cloaked the same way other stealth units are: invisible beyond point-blank range to non-detectors, visible to detectors at full range, and briefly exposed to everyone right after it fires. Hard-hitting but slow to reload, rewarding a strike-and-reposition style."
}
