{
  "id": "transport_carrier",
  "name": "Transport Carrier",
  "domain": "Land",
  "tags": ["Vehicle", "Support"],

  "hp": 150,
  "damage": 0,
  "attackSpeed": 0,
  "range": 0,
  "splashRadius": 0,
  "visionRange": 8,
  "speed": 2.8,

  "maxSquadSize": 1,

  "canTarget": [],

  "cargoCapacity": 1,
  "cargoAllowedTags": ["Infantry"],
  "canLaunchCargoMidCombat": true,

  "cost": { "food": 20, "steel": 20 },
  "foodUpkeep": 0,
  "fuelUpkeep": 1,
  "productionTime": 15,

  "notes": "Fully unarmed; relies on escort or its own cargo for protection. cargoCapacity counts squads, not troop headcount: 1 means it carries one Infantry squad aboard (any size up to that squad's own maxSquadSize). Fuel upkeep only while moving, per Land-domain rules."
}
