{
  "id": "earthshaker",
  "name": "Earthshaker",
  "domain": "Land",
  "tags": ["Vehicle", "Tank", "Heavy", "Siege"],

  "hp": 340,
  "armor": 3,
  "damage": 95,
  "attackSpeed": 0.2,
  "range": 8,
  "minRange": 2,
  "splashRadius": 3,
  "projectileSpeed": 3,
  "visionRange": 8,
  "speed": 1.1,

  "maxSquadSize": 2,

  "canTarget": ["Infantry", "Land", "Structure", "Defensive"],

  "damageDealtModifiers": { "Structure": 0.6, "Defensive": 0.8},

  "cost": { "food": 20, "steel": 110},
  "foodUpkeep": 0,
  "fuelUpkeep": 2.5,
  "productionTime": 85,

  "notes": "Heavy siege vehicle with the hardest-hitting splash attack in the roster, balanced by slow firing and slow movement. Cannot fire at point-blank range or hit aircraft, and its small squads are especially vulnerable to infantry that close the gap."
}
