{
  "id": "shadowcopter",
  "name": "Shadowcopter",
  "domain": "Air",
  "tags": ["Aircraft", "Stealth"],

  "hp": 55,
  "damage": 14,
  "attackSpeed": 1.0,
  "range": 8,
  "splashRadius": 0,
  "projectileSpeed": 13,
  "visionRange": 8,
  "speed": 2.0,

  "maxSquadSize": 2,

  "canTarget": ["Infantry", "Land", "Air", "Naval", "Structure", "Defensive"],

  "stealth": true,
  "revealRange": 2,
  "revealsOnAttack": false,

  "cost": { "food": 25, "steel": 75 },
  "foodUpkeep": 0,
  "fuelUpkeep": 4,
  "productionTime": 56,

  "notes": "Long-range stealth aircraft whose cloak never drops from firing, letting it snipe from a safe distance indefinitely — only wandering into a detector's range exposes it. Fragile and unremarkable in damage, with a heavy fuel appetite among aircraft."
}
