{
  "id": "commander_warden",
  "name": "Warden",
  "domain": "Land",
  "tags": ["Vehicle", "Commander", "Support"],

  "hp": 260,
  "armor": 8,
  "damage": 12,
  "attackSpeed": 1.0,
  "range": 4,
  "splashRadius": 0,
  "projectileSpeed": 16,
  "visionRange": 9,
  "speed": 2.4,

  "maxSquadSize": 1,
  "maxSquadsLed": 4,
  "commanderTier": "rare",

  "canTarget": ["Infantry", "Land", "Air", "Naval", "Structure", "Defensive"],

  "auras": [
    {
      "radius": 999,
      "target": "friendly_troops",
      "filter": "own_regiment_and_self",
      "effect": "heal_out_of_combat",
      "magnitude": 4
    }
  ],

  "cost": { "food": 80, "steel": 100 },
  "foodUpkeep": 3,
  "fuelUpkeep": 5,
  "productionTime": 60,

  "notes": "Rare command unit that slowly restores health to itself and every squad serving under it once they've gone a while without taking damage. A between-fights sustain tool rather than something that helps mid-engagement."
}
