{
  "id": "disruptor",
  "name": "Disruptor",
  "domain": "Land",
  "tags": ["Vehicle", "Support", "Heavy"],

  "hp": 90,
  "damage": 0,
  "attackSpeed": 0,
  "range": 0,
  "splashRadius": 0,
  "visionRange": 6,
  "speed": 2.2,

  "maxSquadSize": 1,

  "canTarget": [],

  "auras": [
    { "radius": 6, "target": "enemy_buildings", "filter": "Defensive", "effect": "suppress_targeting" }
  ],

  "cost": { "food": 20, "steel": 45 },
  "foodUpkeep": 0,
  "fuelUpkeep": 2,
  "productionTime": 22,

  "notes": "Non-combat electronic-warfare vehicle whose presence stops nearby enemy defensive buildings from targeting anything. Unarmed and only modestly durable, so it needs escort to reach useful range — killing it instantly restores whatever it was suppressing."
}
