{
  "id": "frost_tank",
  "name": "Frost Tank",
  "domain": "Land",
  "tags": ["Vehicle", "Tank", "Ice", "Heavy"],

  "hp": 260,
  "armor": 2,
  "damage": 18,
  "attackSpeed": 1.2,
  "range": 4,
  "splashRadius": 2,
  "projectileSpeed": 9,
  "visionRange": 8,
  "speed": 2.0,

  "maxSquadSize": 4,

  "canTarget": ["Infantry", "Land", "Air", "Naval", "Structure", "Defensive"],

  "statusEffectOnHit": { "type": "freeze", "duration": 2, "chance": 25 },

  "cost": { "food": 25, "steel": 65 },
  "foodUpkeep": 0,
  "fuelUpkeep": 3,
  "productionTime": 28,

  "notes": "Vehicle whose attacks have a chance to fully freeze the target in place, useful for locking down a dangerous threat rather than maximizing damage output. Otherwise an unremarkable vehicle with no combat bonuses of its own."
}
