{
  "id": "commander_nightfall",
  "name": "Nightfall",
  "domain": "Land",
  "tags": ["Vehicle", "Commander", "Stealth"],

  "hp": 190,
  "armor": 5,
  "damage": 14,
  "attackSpeed": 1.0,
  "range": 4,
  "splashRadius": 0,
  "projectileSpeed": 16,
  "visionRange": 9,
  "speed": 2.6,

  "maxSquadSize": 1,
  "maxSquadsLed": 4,
  "commanderTier": "epic",

  "canTarget": ["Infantry", "Land", "Air", "Naval", "Structure", "Defensive"],

  "stealth": true,
  "revealRange": 1,
  "revealsOnAttack": true,

  "auras": [
    {
      "radius": 999,
      "target": "friendly_troops",
      "filter": "own_regiment",
      "effect": "grant_stealth"
    }
  ],

  "cost": { "food": 100, "steel": 130 },
  "foodUpkeep": 4,
  "fuelUpkeep": 6,
  "productionTime": 75,

  "notes": "Epic command unit that extends its own cloak to every squad serving under it, letting a whole formation approach unseen. Each squad only breaks its own cloak when it attacks, not the group's. Fragile like other commanders and a high-value kill if caught."
}
