{
  "id": "quad_bike",
  "name": "Quad-bike",
  "domain": "Land",
  "tags": ["Vehicle", "Light"],

  "hp": 85,
  "damage": 8,
  "attackSpeed": 1.2,
  "range": 4,
  "splashRadius": 0,
  "projectileSpeed": 14,
  "visionRange": 8,
  "speed": 2.8,

  "maxSquadSize": 6,

  "canTarget": ["Infantry", "Land", "Structure", "Defensive"],

  "damageDealtModifiers": { "Infantry": 1.4},

  "terrainOverrides": { "ignoresForestBlock": true },

  "cost": { "food": 15, "steel": 15 },
  "foodUpkeep": 0,
  "fuelUpkeep": 1,
  "productionTime": 10,

  "notes": "The fastest ground vehicle in the roster, lightly armored and cheap, able to cross terrain other land vehicles can't. A scout/skirmisher role rather than a real fighter — no bonus against aircraft or ships, though it can still contest defenses and plain structures."
}
